{
  "schema_version":1,"benchmark_version":"1.3-d",
  "cases":[
    {"id":"policy-schema-valid","expected":"pass"},
    {"id":"all-required-suites-present","expected":"pass"},
    {"id":"benchmark-report-machine-readable","expected":"pass"},
    {"id":"command-failure-blocks-release","expected":"fail_closed"},
    {"id":"benchmark-threshold-blocks-regression","expected":"fail_closed"},
    {"id":"db-migration-change-blocked","expected":"fail_closed"},
    {"id":"release-gate-precedes-build","expected":"pass"},
    {"id":"real-api-disabled","expected":"pass"},
    {"id":"dirty-ci-worktree-blocked","expected":"fail_closed"}
  ],
  "safety_boundaries":[
    "router_output_is_not_evidence","no_real_paid_api","database_schema_and_migrations_are_protected",
    "windows_build_runs_only_after_release_gate","release_gate_never_creates_tag_or_release"
  ]
}
